{
  "generatedBy": "Prumo protocol compiler",
  "protocolVersion": "2.0.0",
  "sourceHash": "9b0eec856ee7d76db69b916ccdb813a5294c9382620bacc09e8abd59c6709364",
  "ruleCount": 201,
  "ruleRange": {
    "first": "PRU-01",
    "last": "PRU-267"
  },
  "sections": [
    {
      "number": 0,
      "title": "Session bootstrap",
      "line": 39,
      "rules": [
        "PRU-01",
        "PRU-02",
        "PRU-03",
        "PRU-04",
        "PRU-05"
      ]
    },
    {
      "number": 1,
      "title": "Density per round",
      "line": 80,
      "rules": [
        "PRU-10",
        "PRU-11",
        "PRU-12",
        "PRU-13",
        "PRU-14",
        "PRU-15",
        "PRU-16",
        "PRU-17"
      ]
    },
    {
      "number": 2,
      "title": "Code guidelines",
      "line": 106,
      "rules": [
        "PRU-20",
        "PRU-21",
        "PRU-22",
        "PRU-23",
        "PRU-24",
        "PRU-25",
        "PRU-26",
        "PRU-27",
        "PRU-28",
        "PRU-29"
      ]
    },
    {
      "number": 3,
      "title": "Communication guidelines",
      "line": 130,
      "rules": [
        "PRU-30",
        "PRU-31",
        "PRU-32",
        "PRU-33",
        "PRU-34",
        "PRU-35",
        "PRU-36",
        "PRU-37"
      ]
    },
    {
      "number": 4,
      "title": "Ambiguity and questions",
      "line": 152,
      "rules": [
        "PRU-40",
        "PRU-41",
        "PRU-42",
        "PRU-43",
        "PRU-44",
        "PRU-45",
        "PRU-46"
      ]
    },
    {
      "number": 5,
      "title": "Specification",
      "line": 175,
      "rules": [
        "PRU-50",
        "PRU-51",
        "PRU-52",
        "PRU-53",
        "PRU-54"
      ]
    },
    {
      "number": 6,
      "title": "Internal tools",
      "line": 198,
      "rules": [
        "PRU-60",
        "PRU-61",
        "PRU-62",
        "PRU-63",
        "PRU-64",
        "PRU-65",
        "PRU-66",
        "PRU-67",
        "PRU-68"
      ]
    },
    {
      "number": 7,
      "title": "Subagents (expensive resource, restricted use)",
      "line": 222,
      "rules": [
        "PRU-70",
        "PRU-71",
        "PRU-72",
        "PRU-73",
        "PRU-74",
        "PRU-75",
        "PRU-76",
        "PRU-77"
      ]
    },
    {
      "number": 8,
      "title": "Worktrees",
      "line": 253,
      "rules": [
        "PRU-80",
        "PRU-81",
        "PRU-82",
        "PRU-83",
        "PRU-84",
        "PRU-85"
      ]
    },
    {
      "number": 9,
      "title": "Git, versioning, and commits",
      "line": 280,
      "rules": [
        "PRU-90",
        "PRU-91",
        "PRU-92",
        "PRU-93",
        "PRU-94",
        "PRU-95",
        "PRU-96",
        "PRU-97",
        "PRU-98",
        "PRU-99"
      ]
    },
    {
      "number": 10,
      "title": "MapSource.md",
      "line": 347,
      "rules": [
        "PRU-100",
        "PRU-101",
        "PRU-102",
        "PRU-103",
        "PRU-104"
      ]
    },
    {
      "number": 11,
      "title": "Self-audit and preventive bug hunting",
      "line": 402,
      "rules": [
        "PRU-110",
        "PRU-111",
        "PRU-112",
        "PRU-113",
        "PRU-114",
        "PRU-115"
      ]
    },
    {
      "number": 12,
      "title": "Public text and the fight against AI slop",
      "line": 428,
      "rules": [
        "PRU-120",
        "PRU-121",
        "PRU-122",
        "PRU-123",
        "PRU-124",
        "PRU-125",
        "PRU-126",
        "PRU-127",
        "PRU-128",
        "PRU-129",
        "PRU-130"
      ]
    },
    {
      "number": 13,
      "title": "README.md",
      "line": 484,
      "rules": [
        "PRU-140",
        "PRU-141",
        "PRU-142"
      ]
    },
    {
      "number": 14,
      "title": "Delivery gate",
      "line": 506,
      "rules": [
        "PRU-150",
        "PRU-151"
      ]
    },
    {
      "number": 15,
      "title": "Honest verdict: criticism without flattery",
      "line": 523,
      "rules": [
        "PRU-152",
        "PRU-153",
        "PRU-154",
        "PRU-155",
        "PRU-156",
        "PRU-157",
        "PRU-158",
        "PRU-159"
      ]
    },
    {
      "number": 16,
      "title": "Clean Code in practice",
      "line": 587,
      "rules": [
        "PRU-160",
        "PRU-161",
        "PRU-162",
        "PRU-163",
        "PRU-164",
        "PRU-165",
        "PRU-166",
        "PRU-167",
        "PRU-168",
        "PRU-169",
        "PRU-170",
        "PRU-171",
        "PRU-172",
        "PRU-173",
        "PRU-174",
        "PRU-175",
        "PRU-176",
        "PRU-177",
        "PRU-178",
        "PRU-179",
        "PRU-180",
        "PRU-181",
        "PRU-182"
      ]
    },
    {
      "number": 17,
      "title": "Diagrams with Archify",
      "line": 719,
      "rules": [
        "PRU-190",
        "PRU-191",
        "PRU-192",
        "PRU-193",
        "PRU-194",
        "PRU-195",
        "PRU-196",
        "PRU-197",
        "PRU-198",
        "PRU-199",
        "PRU-200"
      ]
    },
    {
      "number": 18,
      "title": "Security and personal-data audit",
      "line": 797,
      "rules": [
        "PRU-210",
        "PRU-211",
        "PRU-212",
        "PRU-213",
        "PRU-214",
        "PRU-215",
        "PRU-216",
        "PRU-217",
        "PRU-218",
        "PRU-219",
        "PRU-220",
        "PRU-221",
        "PRU-222",
        "PRU-223",
        "PRU-224",
        "PRU-225",
        "PRU-226",
        "PRU-227",
        "PRU-228",
        "PRU-229",
        "PRU-230",
        "PRU-231",
        "PRU-232",
        "PRU-233",
        "PRU-234",
        "PRU-235",
        "PRU-236",
        "PRU-237",
        "PRU-238",
        "PRU-239"
      ]
    },
    {
      "number": 19,
      "title": "Hypothesis-driven debugging",
      "line": 942,
      "rules": [
        "PRU-240",
        "PRU-241",
        "PRU-242",
        "PRU-243",
        "PRU-244",
        "PRU-245",
        "PRU-246",
        "PRU-247"
      ]
    },
    {
      "number": 20,
      "title": "Protocol integrity and runtime",
      "line": 964,
      "rules": [
        "PRU-250",
        "PRU-251",
        "PRU-252",
        "PRU-253",
        "PRU-254",
        "PRU-255",
        "PRU-256",
        "PRU-257",
        "PRU-258",
        "PRU-259",
        "PRU-260",
        "PRU-261",
        "PRU-262",
        "PRU-263",
        "PRU-264",
        "PRU-265",
        "PRU-266",
        "PRU-267"
      ]
    },
    {
      "appendix": "A",
      "title": "Study references",
      "line": 1016,
      "rules": []
    }
  ],
  "chapters": [
    {
      "id": "coding",
      "title": "Coding",
      "sections": [
        1,
        2,
        6,
        11,
        14,
        16
      ],
      "defaultLoad": true,
      "nonSuppressible": false,
      "rules": [
        "PRU-10",
        "PRU-11",
        "PRU-12",
        "PRU-13",
        "PRU-14",
        "PRU-15",
        "PRU-16",
        "PRU-17",
        "PRU-20",
        "PRU-21",
        "PRU-22",
        "PRU-23",
        "PRU-24",
        "PRU-25",
        "PRU-26",
        "PRU-27",
        "PRU-28",
        "PRU-29",
        "PRU-60",
        "PRU-61",
        "PRU-62",
        "PRU-63",
        "PRU-64",
        "PRU-65",
        "PRU-66",
        "PRU-67",
        "PRU-68",
        "PRU-110",
        "PRU-111",
        "PRU-112",
        "PRU-113",
        "PRU-114",
        "PRU-115",
        "PRU-150",
        "PRU-151",
        "PRU-160",
        "PRU-161",
        "PRU-162",
        "PRU-163",
        "PRU-164",
        "PRU-165",
        "PRU-166",
        "PRU-167",
        "PRU-168",
        "PRU-169",
        "PRU-170",
        "PRU-171",
        "PRU-172",
        "PRU-173",
        "PRU-174",
        "PRU-175",
        "PRU-176",
        "PRU-177",
        "PRU-178",
        "PRU-179",
        "PRU-180",
        "PRU-181",
        "PRU-182"
      ],
      "tokens": 4660,
      "triggers": [
        {
          "id": "source-edit",
          "description": "task edits source code",
          "signals": [
            "edit",
            "feature",
            "implement"
          ],
          "paths": [
            "\\.(m?[jt]sx?|py|go|rs|java|kt|rb|php|cs|c|cc|cpp|h|hpp|swift|scala|ex|exs|dart|lua|sh|ps1)$"
          ],
          "keywords": [
            "implement",
            "add",
            "create",
            "write",
            "refactor",
            "fix",
            "change",
            "update",
            "build"
          ]
        }
      ]
    },
    {
      "id": "specification",
      "title": "Specification and questions",
      "sections": [
        4,
        5
      ],
      "defaultLoad": true,
      "nonSuppressible": false,
      "rules": [
        "PRU-40",
        "PRU-41",
        "PRU-42",
        "PRU-43",
        "PRU-44",
        "PRU-45",
        "PRU-46",
        "PRU-50",
        "PRU-51",
        "PRU-52",
        "PRU-53",
        "PRU-54"
      ],
      "tokens": 930,
      "triggers": [
        {
          "id": "new-work",
          "description": "task starts new work or the request is ambiguous",
          "signals": [
            "feature",
            "implement",
            "ambiguous",
            "question"
          ],
          "keywords": [
            "spec",
            "requirement",
            "should i",
            "which",
            "ambiguous",
            "clarify",
            "option"
          ]
        }
      ]
    },
    {
      "id": "communication",
      "title": "Communication",
      "sections": [
        3
      ],
      "defaultLoad": false,
      "nonSuppressible": false,
      "rules": [
        "PRU-30",
        "PRU-31",
        "PRU-32",
        "PRU-33",
        "PRU-34",
        "PRU-35",
        "PRU-36",
        "PRU-37"
      ],
      "tokens": 688,
      "triggers": [
        {
          "id": "long-report",
          "description": "task ends with a report, summary or explanation",